{
  "id": "engine-model-D",
  "role": "force",
  "cohen_type": "credos",
  "viewpoint_origin": "conversión / apostasía comparada en religiones mayoritarias; paradigmas tecnológicos (API vs P2P/SLM) con lente Teilhard de Chardin",
  "lore_hook": "tablas de credo y ruptura confesional — condiciones de entrada y salida por fe; contraste 2001/Solaris aplicado a IA y FOSS español",
  "anchor_scene": "sesion-01-conversion-apostasia/01-conversion-apostasia-tablas",
  "activation_triggers": [
    "conversion",
    "apostasia",
    "credo",
    "religion",
    "monoteismo",
    "chardin",
    "solaris",
    "2001",
    "p2p",
    "petals",
    "slm",
    "foss",
    "freepi",
    "magnific"
  ],
  "pairs_with": ["engine-model-F", "cima-aleph"],
  "status": "indexed",
  "raw_sources": [
    { "file": "raw/logs-agent-1.md", "lines": 52 },
    { "file": "raw/logs-agent-2.md", "lines": 127 }
  ],
  "estimated_scenes": 4,
  "notes": "Expert Mode; trace «Search unavailable»; tablas abrahámicas + hinduismo/budismo/sijismo; sesión 02 paradigmas IA (API vs P2P/Petals/SLM) con Chardin, FreePI y Magnific"
}
